Exchange,Symbol,Shortname,Longname,Sector,Industry,Currentprice,Marketcap,Ebitda,Revenuegrowth,City,State,Country,Fulltimeemployees,Longbusinesssummary,Weight
NYQ,JBL,Jabil Inc.,Jabil Inc.,Technology,Electronic Components,138.02,16644798464,2356000000,-0.168,Saint Petersburg,FL,United States,236000,"Jabil Inc. provides manufacturing services and solutions worldwide. It operates in two segments, Electronics Manufacturing Services and Diversified Manufacturing Services. The company offers electronics design, production, and product management services; electronic circuit design services, such as application-specific integrated circuit design, firmware development, and rapid prototyping services; and designs plastic and metal enclosures that include the electro-mechanics, such as the printed circuit board assemblies (PCBA). It also provides three-dimensional mechanical design comprising the analysis of electronic, electro-mechanical, and optical assemblies, as well as various industrial design, mechanism development, and tooling management services. In addition, the company provides computer-assisted design services consisting of PCBA design, as well as PCBA design validation and verification services; and other consulting services, such as the generation of a bill of materials, approved vendor list, and assembly equipment configuration for various PCBA designs. Further, it offers product and process validation services, such as product system, product safety, regulatory compliance, and reliability tests, as well as manufacturing test solution development services. Additionally, the company provides systems assembly, test, direct-order fulfillment, and configure-to-order services. It serves 5G, wireless and cloud, digital print and retail, industrial and semi-cap, networking and storage, automotive and transportation, connected devices, healthcare and packaging, and mobility industries. The company was formerly known as Jabil Circuit, Inc. and changed its name to Jabil Inc. in June 2017. Jabil Inc. was founded in 1966 and is headquartered in Saint Petersburg, Florida.",0.0003436543645733181
NYQ,EQT,EQT Corporation,EQT Corporation,Energy,Oil & Gas E&P,37.49,16522631168,4268210944,-0.474,Pittsburgh,PA,United States,881,"EQT Corporation operates as a natural gas production company in the United States. The company sells natural gas and natural gas liquids to marketers, utilities, and industrial customers through pipelines located in the Appalachian Basin. It also offers marketing services and contractual pipeline capacity management services. The company was formerly known as Equitable Resources Inc. and changed its name to EQT Corporation in February 2009. EQT Corporation was founded in 1878 and is headquartered in Pittsburgh, Pennsylvania.",0.00034113205560278156
NGM,ENPH,"Enphase Energy, Inc.","Enphase Energy, Inc.",Technology,Solar,121.7,16521871360,526300992,-0.582,Fremont,CA,United States,3157,"Enphase Energy, Inc., together with its subsidiaries, designs, develops, manufactures, and sells home energy solutions for the solar photovoltaic industry in the United States and internationally. The company offers semiconductor-based microinverter, which converts energy at the individual solar module level and combines with its proprietary networking and software technologies to provide energy monitoring and control. It also provides microinverter units and related accessories, an IQ gateway; IQ batteries; the cloud-based Enlighten monitoring service; storage solutions; and electric vehicle charging solutions, as well as design, proposal, permitting, and lead generation services. The company sells its solutions to solar distributors; and directly to large installers, original equipment manufacturers, strategic partners, and homeowners, as well as through its legacy product upgrade program or online store. Enphase Energy, Inc. was incorporated in 2006 and is headquartered in Fremont, California.",0.00034111636833952016
NYQ,L,Loews Corporation,Loews Corporation,Financial Services,Insurance - Property & Casualty,73.81,16391134208,2801999872,0.123,New York,NY,United States,12280,"Loews Corporation provides commercial property and casualty insurance in the United States and internationally. The company offers specialty insurance products, such as management and professional liability, and other coverage products; surety and fidelity bonds; property insurance products that include standard and excess property, marine and boiler, and machinery coverages; and casualty insurance products, such as workers' compensation, general and product liability, and commercial auto, surplus, and umbrella coverages. It also provides loss-sensitive insurance programs; and warranty, risk management, information, and claims administration services. The company markets its insurance products and services through independent agents, brokers, and managing general underwriters. In addition, the company is involved in the transportation and storage of natural gas and natural gas liquids, and hydrocarbons through natural gas pipelines covering approximately 13,455 miles of interconnected pipelines; 855 miles of NGL pipelines in Louisiana and Texas; 14 underground storage fields with an aggregate gas capacity of approximately 199.5 billion cubic feet of natural gas; and eleven salt dome caverns and related brine infrastructure for providing brine supply services. Further, the company operates a chain of 25 hotels; and develops, manufactures, and markets a range of extrusion blow-molded and injection molded plastic containers for customers in the pharmaceutical, dairy, household chemicals, food/nutraceuticals, industrial/specialty chemicals, and water and beverage/juice industries, as well as manufactures commodity and differentiated plastic resins from recycled plastic materials. Loews Corporation was incorporated in 1969 and is headquartered in New York, New York.",0.0003384171231072118
NYQ,FDS,FactSet Research Systems Inc.,FactSet Research Systems Inc.,Financial Services,Financial Data & Stock Exchanges,427.27,16285736960,796985024,0.06,Norwalk,CT,United States,12279,"FactSet Research Systems Inc., a financial data company, provides integrated financial information and analytical applications to the investment community in the Americas, Europe, the Middle East, Africa, and the Asia Pacific. The company delivers insight and information through the workflow solutions of research, analytics and trading, content and technology solutions, and wealth. It serves portfolio managers, investment banks, asset managers, wealth advisors, corporate clients, and other financial services entities. FactSet Research Systems Inc. was founded in 1978 and is headquartered in Norwalk, Connecticut.",0.0003362410544472304
NYQ,ESS,"Essex Property Trust, Inc.","Essex Property Trust, Inc.",Real Estate,REIT - Residential,244.25,16233465856,1084536064,-0.044,San Mateo,CA,United States,1747,"Essex Property Trust, Inc., an S&P 500 company, is a fully integrated real estate investment trust (REIT) that acquires, develops, redevelops, and manages multifamily residential properties in selected West Coast markets. Essex currently has ownership interests in 252 apartment communities comprising approximately 62,000 apartment homes with an additional property in active development.",0.0003351618468455573
NYQ,MAS,Masco Corporation,Masco Corporation,Industrials,Building Products & Equipment,73.48,16148332544,1516999936,-0.021,Livonia,MI,United States,18000,"Masco Corporation designs, manufactures, and distributes home improvement and building products in North America, Europe, and internationally. The company's Plumbing Products segment offers faucets, showerheads, handheld showers, valves, bath hardware and accessories, bathing units, shower bases and enclosures, sinks, toilets, acrylic tubs, shower trays, spas, exercise pools, and fitness systems; brass, copper, and composite plumbing system components; connected water products; thermoplastic solutions, extruded plastic profiles, specialized fabrications, and PEX tubing products; and other non-decorative plumbing products. This segment provides its products under the DELTA, BRIZO, PEERLESS, HANSGROHE, AXOR, KRAUS, EASY DRAIN, STEAMIST, ELITESTEAM, GINGER, NEWPORT BRASS, BRASSTECH, WALTEC, BRISTAN, HERITAGE, MIROLIN, HOT SPRING, CALDERA, FREEFLOW SPAS, FANTASY SPAS, ENDLESS POOLS, BRASSCRAFT, PLUMB SHOP, COBRA, COBRA PRO, and MASTER PLUMBER brands. Its Decorative Architectural Products segment offers paints, primers, specialty coatings, stains, and waterproofing products, as well as paint applicators and accessories; cabinet and door hardware, functional hardware, wall plates, hook and rail products, closet organization systems, and picture hanging accessories; decorative bath hardware, mirrors, and shower accessories and doors; and decorative indoor and outdoor lighting fixtures, ceiling fans, landscape lighting, and LED lighting systems. This segment provides its products under the BEHR, KILZ, WHIZZ, Elder & Jenks, LIBERTY, BRAINERD, FRANKLIN BRASS, KICHLER, and LAN brands. It sells its products to the plumbing, heating, and hardware wholesalers; home centers and online retailers; hardware stores; electrical and landscape distributors; lighting showrooms; building supply outlets; and other mass merchandisers. Masco Corporation was incorporated in 1929 and is headquartered in Livonia, Michigan.",0.0003334041545368965
NMS,AKAM,"Akamai Technologies, Inc.","Akamai Technologies, Inc.",Technology,Software - Infrastructure,105.09,16100943872,1101026048,0.072,Cambridge,MA,United States,10250,"Akamai Technologies, Inc. provides cloud computing, security, and content delivery services in the United States and internationally. The company offers cloud solutions to keep infrastructure, websites, applications, application programming interfaces, and users safe from various cyberattacks and online threats while enhancing performance. It also provides web and mobile performance solutions to enable dynamic websites and applications; media delivery solutions, including video streaming and video player services, game and software delivery, broadcast operations, authoritative domain name system, resolution, and data and analytics; and cloud computing services, such as compute, storage, networking, database, and container management services to build, deploy, and secure applications and workloads. In addition, the company offers content delivery solutions; and an array of service and support to assist customers with integrating, configuring, optimizing, and managing its offerings. It sells its solutions through various channel partners. Akamai Technologies, Inc. was incorporated in 1998 and is headquartered in Cambridge, Massachusetts.",0.00033242575134388963
NYQ,NRG,"NRG Energy, Inc.","NRG Energy, Inc.",Utilities,Utilities - Independent Power Producers,74.59,16017008640,282000000,-0.133,Houston,TX,United States,18131,"NRG Energy, Inc., together with its subsidiaries, operates as an energy and home services company in the United States and Canada. It operates through Texas; East; West/Services/Other; Vivint Smart Home; and Corporate Activities segments. The company produces and sells electricity generated using coal, oil, solar, and battery storage; natural gas; and a cloud-based home platform, including hardware, software, sales, installation, customer service, technical support, and professional monitoring solutions. It offers retail electricity and energy management, line and surge protection products, HVAC installation, repair and maintenance, home protection products, carbon offsets, back-up power stations, portable power, portable solar, and portable lighting; retail services comprising demand response, commodity sales, energy efficiency, and energy management solutions; and system power, distributed generation, renewable and low-carbon products, carbon management and specialty services, backup generation, storage and distributed solar, and energy advisory services. In addition, the company trades in power, natural gas, and related commodities; environmental products; weather products; and financial products, including forwards, futures, options, and swaps. It offers its products and services under the NRG, Reliant, Direct Energy, Green Mountain Energy, and Vivint. It serves residential, commercial, government, industrial, and wholesale customers. NRG Energy, Inc. was founded in 1989 and is headquartered in Houston, Texas.",0.00033069279501638226
NYQ,EG,"Everest Group, Ltd.","Everest Group, Ltd.",Financial Services,Insurance - Reinsurance,366.15,15884172288,,0.139,Hamilton,,Bermuda,2844,"Everest Group, Ltd., through its subsidiaries, provides reinsurance and insurance products in the United States, Europe, and internationally. The company operates through two segment, Insurance and Reinsurance. The Reinsurance segment writes property and casualty reinsurance; and specialty lines of business through reinsurance brokers, as well as directly with ceding companies in the United States, Bermuda, Ireland, Canada, Singapore, Switzerland, and the United Kingdom. The Insurance Operations segment writes property and casualty insurance directly, as well as through brokers, surplus lines, and general agents in the United States, Bermuda, Canada, Europe, South America, Singapore, France, Germany, Spain, Canada, Chile, the United Kingdom, Ireland, and the Netherlands. The company also provides treaty and facultative reinsurance products; admitted and non-admitted insurance products; and accident and health, specialty underwriters, eversports and entertainment, and surety and credit, marine and aviation, as well as structured and property hybrid solutions. In addition, it offers commercial property and casualty insurance products through wholesale and retail brokers, surplus lines brokers, and program administrators. The company was formerly known as Everest Re Group, Ltd. and changed its name to Everest Group, Ltd. in July 2023.Everest Group, Ltd., was founded in 1973 and is headquartered in Hamilton, Bermuda.",0.00032795020896239483
NYQ,MAA,Mid-America Apartment Communiti,"Mid-America Apartment Communities, Inc.",Real Estate,REIT - Residential,131.99,15821773824,1254759040,0.027,Germantown,TN,United States,2427,"MAA, an S&P 500 company, is a real estate investment trust (REIT) focused on delivering full-cycle and superior investment performance for shareholders through the ownership, management, acquisition, development and redevelopment of quality apartment communities primarily in the Southeast, Southwest and Mid-Atlantic regions of the United States. As of December 31, 2023, MAA had ownership interest in 102,662 apartment units, including communities currently in development, across 16 states and the District of Columbia.",0.0003266619083234505
NMS,WBA,"Walgreens Boots Alliance, Inc.","Walgreens Boots Alliance, Inc.",Healthcare,Pharmaceutical Retailers,18.08,15591757824,4016000000,0.1,Deerfield,IL,United States,330000,"Walgreens Boots Alliance, Inc. operates as a healthcare, pharmacy, and retail company in the United States, the United Kingdom, Germany, and internationally. It operates through three segments: U.S. Retail Pharmacy, International, and U.S. Healthcare. The U.S. Retail Pharmacy segment engages in operation of the retail drugstores, health and wellness services, specialty, and home delivery pharmacy services, which offers health and wellness, beauty, personal care and consumables, and general merchandise. The International segment offers sale of prescription drugs and health and wellness, beauty, personal care, and other consumer products outside the United States; and operates pharmacy-led health and beauty retail businesses under the Boots brand stores in the United Kingdom, the Republic of Ireland, and Thailand, as well as the Benavides brand in Mexico and the Ahumada brand in Chile. The U.S. Healthcare segment provides VillageMD, a national provider of value-based care with primary, multi-specialty, and urgent care providers serving patients in traditional clinic settings, in patients' homes and online appointments; Shields, a specialty pharmacy integrator and accelerator for hospitals; and CareCentrix, a participant in the post-acute and home care management sectors. Walgreens Boots Alliance, Inc. was founded in 1909 and is headquartered in Deerfield, Illinois.",0.0003219129170699571
NYQ,EPAM,"EPAM Systems, Inc.","EPAM Systems, Inc.",Technology,Information Technology Services,266.51,15411607552,675449024,-0.06,Newtown,PA,United States,53150,"EPAM Systems, Inc. provides digital platform engineering and software development services worldwide. The company offers engineering services, including requirements analysis and platform selection, customization, cross-platform migration, implementation, and integration; infrastructure management services, such as software development, testing, performance tuning, deployment, maintenance, and support services. It also provides operation solutions comprising integrated engineering practices and smart automation services. In addition, the company offers business, experience, technology, data, and technical advisory consulting services; and digital and service design solutions, which comprise strategy, design, creative, and program management services, as well as physical product development, such as artificial intelligence, robotics, and virtual reality. The company serves the financial services, travel and consumer, software and hi-tech, business information and media, life sciences and healthcare, and other industries EPAM Systems, Inc. was founded in 1993 and is headquartered in Newtown, Pennsylvania.",0.00031819347117905186
NYQ,SNA,Snap-On Incorporated,Snap-on Incorporated,Industrials,Tools & Accessories,291.54,15404507136,1436999936,0.04,Kenosha,WI,United States,13200,"Snap-on Incorporated manufactures and markets tools, equipment, diagnostics, and repair information and systems solutions for professional users worldwide. It operates through Commercial & Industrial Group, Snap-on Tools Group, Repair Systems & Information Group, and Financial Services segments. The company provides hand tools, including wrenches, sockets, ratchet wrenches, pliers, screwdrivers, punches and chisels, saws and cutting tools, pruning tools, torque measuring instruments, and other related products; power tools, such as cordless, pneumatic, and hydraulic and corded tools; and tool storage products comprising tool chests, roll cabinets, and other products. It provides handheld and computer-based diagnostic products, service and repair information products, diagnostic software solutions, electronic parts catalogs, business management systems and services, point-of-sale systems, integrated systems for vehicle service shops, original equipment manufacturer purchasing facilitation services, and warranty management systems and analytics; and engineered solutions. In addition, the company offers solutions for the service of vehicles and industrial equipment that include wheel alignment equipment, wheel balancers, tire changers, vehicle lifts, test lane equipment, collision repair equipment, vehicle air conditioning service equipment, brake service equipment, fluid exchange equipment, transmission troubleshooting equipment, safety testing equipment, battery chargers, and hoists, as well as after-sales support services and training programs. Further, it provides financing programs to facilitate the sales of its products and support its franchise business. It serves the aviation and aerospace, agriculture, infrastructure construction, government and military, mining, natural resources, power generation, and technical education industries. Snap-on Incorporated was incorporated in 1920 and is headquartered in Kenosha, Wisconsin.",0.00031804687349245545
NYQ,CFG,"Citizens Financial Group, Inc.","Citizens Financial Group, Inc.",Financial Services,Banks - Regional,33.57,15388454912,,-0.108,Providence,RI,United States,17570,"Citizens Financial Group, Inc. operates as the bank holding company that provides retail and commercial banking products and services to individuals, small businesses, middle-market companies, corporations, and institutions in the United States. The company operates in two segments, Consumer Banking and Commercial Banking. The Consumer Banking segment offers deposit products, mortgage and home equity lending products, credit cards, business loans, wealth management, and investment services; and auto, education, and point-of-sale finance loans, as well as digital deposit products. This segment serves its customers through telephone service centers, as well as through its online and mobile platforms. The Commercial Banking segment provides various financial products and solutions, including lending and leasing, deposit and treasury management services, foreign exchange, and interest rate and commodity risk management solutions, as well as syndicated loans, corporate finance, mergers and acquisitions, and debt and equity capital markets services. This segment serves corporate banking, healthcare, technology, asset finance, franchise finance, leasing, asset-based lending, commercial real estate, mid-corporate, and private equity sponsor industries. The company was formerly known as RBS Citizens Financial Group, Inc. and changed its name to Citizens Financial Group, Inc. in April 2014. Citizens Financial Group, Inc. was founded in 1828 and is headquartered in Providence, Rhode Island.",0.00031771545362872805
NMS,NDSN,Nordson Corporation,Nordson Corporation,Industrials,Specialty Industrial Machinery,268.89,15378411520,815385024,0.037,Westlake,OH,United States,7900,"Nordson Corporation engineers, manufactures, and markets products and systems to dispense, apply, and control adhesives, coatings, polymers, sealants, biomaterials, and other fluids worldwide. It operates through three segments: Industrial Precision Solutions; Medical and Fluid Solutions; and Advanced Technology Solutions. The Industrial Precision Solutions segment provides dispensing, coating, and laminating systems for adhesives, lotions, liquids, and fibers to disposable products and roll goods; automated adhesive dispensing systems used in packaged goods industries; components and systems used in the thermoplastic and biopolymer melt stream; precision agriculture spraying solutions; fluid components, such as nozzles, pumps, and filters; and product assembly systems for use in paper and paperboard converting applications, and manufacturing roll goods. It also offers automated and manual dispensing products and systems for cold materials, container coating, liquid finishing, and powder coating, as well as ultraviolet equipment used primarily in curing and drying operations. The Medical and Fluid Solutions segment offers medical devices, including cannulas, catheters, and medical balloons; single-use plastic components; precision manual and semi-automated dispensers; minimally invasive interventional delivery devices; and plastic molded syringes, cartridges, tips, and fluid connection components. The Advanced Technology Solutions segment provides automated dispensing systems for the attachment, protection, and coating of fluids, as well as related gas plasma treatment systems for cleaning and conditioning surfaces; and bond testing and automated optical, acoustic microscopy, and x-ray inspection systems for use in semiconductor and printed circuit board industries. The company markets its products through direct sales force, as well as distributors and sales representatives. Nordson Corporation was founded in 1909 and is headquartered in Westlake, Ohio.",0.00031750809422432396
NYQ,ALB,Albemarle Corporation,Albemarle Corporation,Basic Materials,Specialty Chemicals,130.31,15314682880,897067008,-0.101,Charlotte,NC,United States,9000,"Albemarle Corporation develops, manufactures, and markets engineered specialty chemicals worldwide. It operates through three segments: Energy Storage, Specialties and Ketjen. The Energy Storage segment offers lithium compounds, including lithium carbonate, lithium hydroxide, and lithium chloride; technical services for the handling and use of reactive lithium products; and lithium-containing by-products recycling services. The Specialties segment provides bromine-based specialty chemicals, including elemental bromine, alkyl and inorganic bromides, brominated powdered activated carbon, and other bromine fine chemicals; lithium specialties, such as butyllithium and lithium aluminum hydride; develops and manufactures cesium products for the chemical and pharmaceutical industries; and zirconium, barium, and titanium products for pyrotechnical applications that include airbag initiators. The Ketjen segment offers clean fuels technologies (CFT), which is composed of hydroprocessing catalysts (HPC) together with isomerization and akylation catalysts; fluidized catalytic cracking (FCC) catalysts and additives; and performance catalyst solutions (PCS), which is composed of organometallics and curatives. The company serves the energy storage, petroleum refining, consumer electronics, construction, automotive, lubricants, pharmaceuticals, and crop protection markets. Albemarle Corporation was founded in 1887 and is headquartered in Charlotte, North Carolina.",0.00031619233030374006
