Exchange,Symbol,Shortname,Longname,Sector,Industry,Currentprice,Marketcap,Ebitda,Revenuegrowth,City,State,Country,Fulltimeemployees,Longbusinesssummary,Weight
NMS,STX,Seagate Technology Holdings PLC,Seagate Technology Holdings plc,Technology,Computer Hardware,88.78,18600386560,361000000,-0.176,Dublin,,Ireland,33400,"Seagate Technology Holdings plc provides data storage technology and solutions in Singapore, the United States, the Netherlands, and internationally. It provides mass capacity storage products, including enterprise nearline hard disk drives (HDDs), enterprise nearline solid state drives (SSDs), enterprise nearline systems, video and image HDDs, and network-attached storage drives. The company also offers legacy applications comprising Mission Critical HDDs and SSDs; external storage solutions under the Seagate Ultra Touch, One Touch, and Expansion product lines, as well as under the LaCie brand name; desktop drives; notebook drives, DVR HDDs, and gaming SSDs. In addition, it provides Lyve edge-to-cloud mass capacity platform. The company sells its products primarily to OEMs, distributors, and retailers. Seagate Technology Holdings plc was founded in 1978 and is based in Dublin, Ireland.",0.00038403012436107113
NYQ,DRI,"Darden Restaurants, Inc.","Darden Restaurants, Inc.",Consumer Cyclical,Restaurants,155.01,18501838848,1724800000,0.068,Orlando,FL,United States,187384,"Darden Restaurants, Inc., together with its subsidiaries, owns and operates full-service restaurants in the United States and Canada. It operates under Olive Garden, LongHorn Steakhouse, Cheddar's Scratch Kitchen, Yard House, The Capital Grille, Seasons 52, Bahama Breeze, Eddie V's Prime Seafood, and Capital Burger brand names. Darden Restaurants, Inc. was incorporated in 1995 and is based in Orlando, Florida.",0.00038199547363094896
NYQ,J,Jacobs Solutions Inc.,Jacobs Solutions Inc.,Industrials,Engineering & Construction,145.89,18331224064,1482252032,0.095,Dallas,TX,United States,60000,"Jacobs Solutions Inc. provides consulting, technical, engineering, scientific, and project delivery services for the government and private sectors in the United States, Europe, Canada, India, Asia, Australia, New Zealand, the Middle East, and Africa. It operates through Critical Mission Solutions, People & Places Solutions, Divergent Solutions, and PA Consulting segments. The company offers cyber, data analytics, systems and software application integration and consulting, enterprise level and mission IT, design, nuclear, and enterprise level operations and maintenance services; software development, testing, mission integration, program management, research, development, test, evaluation services, training, and environmental remediation services; and other technical consulting solutions, as well as construction and construction management services. It also provides consulting services for consumer and manufacturing, defense and security, energy and utilities, financial services, government, health and life sciences, and transport industries. The company was founded in 1947 and is headquartered in Dallas, Texas.",0.00037847290077978787
NMS,HOLX,"Hologic, Inc.","Hologic, Inc.",Healthcare,Medical Instruments & Supplies,77.78,18257455104,1247399936,-0.057,Marlborough,MA,United States,6990,"Hologic, Inc. develops, manufactures, and supplies diagnostics products, medical imaging systems, and surgical products for women's health through early detection and treatment. The company operates through four segments: Diagnostics, Breast Health, GYN Surgical, and Skeletal Health. It provides Aptima molecular diagnostic assays to detect the infectious microorganisms; Aptima viral load assays for Hepatitis B virus, Hepatitis C virus, human immunodeficiency virus, and human cytomegalo virus; Aptima bacterial vaginosis and candida vaginitis assays for the diagnosis of vaginitis; Aptima SARS-CoV-2 and Panther Fusion SARS-CoV-2 assays to detect SARS-CoV-2; ThinPrep System for cytology applications; and Rapid Fetal Fibronectin Test that assists physicians in assessing the risk of pre-term birth. The company also offers breast cancer care solutions in the areas of radiology, breast surgery, pathology, and treatment, such as 3D digital mammography systems, image analytics software, reading workstations, minimally invasive breast biopsy guidance systems, breast biopsy site markers, localization, specimen radiology, and connectivity solutions; and breast conserving surgery products. In addition, it provides MyoSure Hysteroscopic Tissue Removal System for the removal of fibroids and polyps in the uterus; NovaSure Endometrial Ablation System to treat abnormal uterine bleeding; Fluent Fluid Management System that provides liquid distention during diagnostic and operative hysteroscopic procedures; Acessa ProVu system to treat various fibroids; and CoolSeal portfolio, such as bipolar vessel sealing devices. Further, the company offers Horizon DXA, a dual energy X-ray system; and Fluoroscan Insight FD mini C-arm to perform minimally invasive orthopedic surgical procedures. It sells its products through direct sales, service forces, independent distributors, and sales representatives. Hologic, Inc. was incorporated in 1985 and is headquartered in Marlborough, Massachusetts.",0.0003769498408803926
NYQ,OMC,Omnicom Group Inc.,Omnicom Group Inc.,Communication Services,Advertising Agencies,92.58,18256777216,2320199936,0.05,New York,NY,United States,75900,"Omnicom Group Inc., together with its subsidiaries, offers advertising, marketing, and corporate communications services. It provides a range of services in the areas of advertising and media, precision marketing, commerce and branding, experiential, execution and support, public relations, and healthcare. The company's services include advertising, branding, content marketing, corporate social responsibility consulting, crisis communications, custom publishing, data analytics, database management, digital/direct marketing and post-production, digital transformation consulting, entertainment marketing, experiential marketing, field marketing, sales support, financial/corporate business-to-business advertising, graphic arts/digital imaging, healthcare marketing and communications, and instore design services. Its services also comprise interactive marketing, investor relations, marketing research, media planning and buying, retail media planning and buying, merchandising and point of sale, mobile marketing, multi-cultural marketing, non-profit marketing, organizational communications, package design, product placement, promotional marketing, public affairs, public relations, retail marketing, retail media and e-commerce, search engine marketing, shopper marketing, social media marketing, and sports and event marketing services. It operates in the North and Latin America, Europe, the Middle East and Africa (EMEA), and the Asia Pacific. The company was incorporated in 1944 and is based in New York, New York.",0.0003769358449662699
NYQ,TXT,Textron Inc.,Textron Inc.,Industrials,Aerospace & Defense,94.62,18203658240,1670000000,0.07,Providence,RI,United States,35000,"Textron Inc. operates in the aircraft, defense, industrial, and finance businesses worldwide. It operates through six segments: Textron Aviation, Bell, Textron Systems, Industrial, Textron eAviation, and Finance. The Textron Aviation segment manufactures, sells, and services business jets, turboprop and piston engine aircraft, and military trainer and defense aircraft; and offers maintenance, inspection, and repair services, as well as sells commercial parts. The Bell segment supplies military and commercial helicopters, tiltrotor aircrafts, and related spare parts and services. The Textron Systems segment offers unmanned aircraft systems, electronic systems and solutions, advanced marine crafts, piston aircraft engines, live military air-to-air and air-to-ship training, weapons and related components, and armored and specialty vehicles. The Industrial segment offers blow-molded solutions, including conventional plastic fuel tanks and pressurized fuel tanks for hybrid vehicle applications, clear-vision systems, plastic tanks for catalytic reduction systems, and battery housing systems for use in electric vehicles primarily to automobile original equipment manufacturers (OEMs); and golf cars, off-road utility vehicles, powersports products, light transportation vehicles, aviation ground support equipment, professional turf-maintenance equipment, and turf-care vehicles to golf courses and resorts, government agencies and municipalities, consumers, outdoor enthusiasts, and commercial and industrial users. The Textron eAviation segment manufactures and sells light aircraft and gliders with electric and combustion engines; and provides other research and development initiatives related to sustainable aviation solutions. The Finance segment offers financing services to purchase new and pre-owned aviation aircraft and Bell helicopters. Textron Inc. was founded in 1923 and is headquartered in Providence, Rhode Island.",0.0003758391319010113
NMS,EXPE,"Expedia Group, Inc.","Expedia Group, Inc.",Consumer Cyclical,Travel Services,133.22,18156288000,1632000000,0.103,Seattle,WA,United States,17100,"Expedia Group, Inc. operates as an online travel company in the United States and internationally. The company operates through B2C, B2B, and trivago segments. Its B2C segment includes Brand Expedia, a full-service online travel brand offers various travel products and services; Hotels.com for lodging accommodations; Vrbo, an online marketplace for the alternative accommodations; Orbitz, Travelocity, Wotif Group, ebookers, CheapTickets, Hotwire.com and CarRentals.com. The company's B2B segment provides various travel and non-travel companies including airlines, offline travel agents, online retailers, corporate travel management, and financial institutions who leverage its travel technology and tap into its diverse supply to augment their offerings and market Expedia Group rates and availabilities to its travelers. Its trivago segment, a hotel metasearch website, which send referrals to online travel companies and travel service providers from hotel metasearch websites. In addition, the company provides brand advertising through online and offline channels, loyalty programs, mobile apps, and search engine marketing, as well as metasearch, social media, direct and personalized traveler communications on its websites, and through direct e-mail communication with its travelers. The company was formerly known as Expedia, Inc. and changed its name to Expedia Group, Inc. in March 2018. Expedia Group, Inc. was founded in 1996 and is headquartered in Seattle, Washington.",0.0003748611092615606
NYQ,CLX,Clorox Company (The),The Clorox Company,Consumer Defensive,Household & Personal Products,144.8,17970548736,1082000000,0.16,Oakland,CA,United States,8700,"The Clorox Company manufactures and markets consumer and professional products worldwide. It operates through four segments: Health and Wellness, Household, Lifestyle, and International. The Health and Wellness segment offers cleaning products, such as laundry additives and home care products primarily under the Clorox, Clorox2, Scentiva, Pine-Sol, Liquid-Plumr, Tilex, and Formula 409 brands; professional cleaning and disinfecting products under the CloroxPro and Clorox Healthcare brands; professional food service products under the Hidden Valley brand; and vitamins, minerals and supplement products under the RenewLife, Natural Vitality, NeoCell, and Rainbow Light brands in the United States. The Household segment provides cat litter products under the Fresh Step and Scoop Away brands; bags and wraps under the Glad brand; and grilling products under the Kingsford brand in the United States. The Lifestyle segment offers dressings, dips, seasonings, and sauces primarily under the Hidden Valley brand; natural personal care products under the Burt's Bees brand; and water-filtration products under the Brita brand in the United States. The International segment provides laundry additives; home care products; water-filtration systems; digestive health products; grilling products; cat litter products; food products; bags and wraps; natural personal care products; and professional cleaning and disinfecting products internationally primarily under the Clorox, Ayudin, Clorinda, Poett, Pine-Sol, Glad, Brita, RenewLife, Ever Clean and Burt's Bees brands. It sells its products primarily through mass retailers; grocery outlets; warehouse clubs; dollar stores; home hardware centers; drug, pet, and military stores; third-party and owned e-commerce channels; and distributors, as well as a direct sales force The Clorox Company was founded in 1913 and is headquartered in Oakland, California.",0.00037102627107566793
NYQ,CE,Celanese Corporation,Celanese Corporation,Basic Materials,Chemicals,160.38,17892474880,1831000064,0.094,Irving,TX,United States,12410,"Celanese Corporation, a chemical and specialty materials company, manufactures and sells high performance engineered polymers in the United States and internationally. It operates through Engineered Materials and Acetyl Chain. The Engineered Materials segment develops, produces, and supplies specialty polymers for automotive and medical applications, as well as for use in industrial products and consumer electronics. The Acetyl Chain segment produces and supplies acetyl products, including acetic acid, vinyl acetate monomers, acetic anhydride, and acetate esters that are used as starting materials for colorants, paints, adhesives, coatings, and pharmaceuticals; and organic solvents and intermediates for pharmaceutical, agricultural, and chemical products. It also offers vinyl acetate-based emulsions for use in paints and coatings, adhesives, construction, glass fiber, textiles, and paper applications; and ethylene vinyl acetate resins and compounds, as well as low-density polyethylene for use in flexible packaging films, lamination film products, hot melt adhesives, automotive parts, and carpeting applications. In addition, it provides redispersible powders (RDP) for use in construction applications, including flooring, plasters, insulation, tiling, and waterproofing. Celanese Corporation was founded in 1918 and is headquartered in Irving, Texas.",0.0003694143307790342
NYQ,IEX,IDEX Corporation,IDEX Corporation,Industrials,Specialty Industrial Machinery,236.25,17881526272,905900032,-0.027,Northbrook,IL,United States,8800,"IDEX Corporation, together with its subsidiaries, provides applied solutions worldwide. The company operates through three segments: Fluid & Metering Technologies (FMT), Health & Science Technologies (HST), and Fire & Safety/Diversified Products (FSDP). The FMT segment designs, produces, and distributes positive displacement pumps, valves, small volume provers, flow meters, injectors, and other fluid-handling pump modules and systems, as well as flow monitoring and other services for the food, chemical, general industrial, water and wastewater, agricultural, and energy industries. The HST segment designs, produces, and distributes precision fluidics positive displacement pumps, powder and liquid processing technologies, drying systems, micro-precision components, pneumatic components and sealing solutions, high performance molded and extruded sealing components, custom mechanical and shaft seals, engineered hygienic mixers and valves, biocompatible medical devices and implantables, air compressors and blowers, optical components and coatings, laboratory and commercial equipment, and precision photonic solutions. This segment serves food and beverage, life sciences, analytical instruments, pharmaceutical and biopharmaceutical, industrial, semiconductor, automotive/transportation, medical/dental, energy, cosmetics, marine, chemical, wastewater and water treatment, research and aerospace/defense markets. The FSDP segment designs, produces, and distributes firefighting pumps, valves and controls, rescue tools, lifting bags, and other components and systems for the fire and rescue industry; engineered stainless steel banding and clamping devices for various industrial and commercial applications; and precision equipment for dispensing, metering, and mixing colorants and paints used in retail and commercial businesses. IDEX Corporation was incorporated in 1987 and is headquartered in Northbrook, Illinois.",0.0003691882819666475
NYQ,RF,Regions Financial Corporation,Regions Financial Corporation,Financial Services,Banks - Regional,19.41,17841438720,,0.156,Birmingham,AL,United States,20101,"Regions Financial Corporation, a financial holding company, provides banking and bank-related services to individual and corporate customers. It operates through three segments: Corporate Bank, Consumer Bank, and Wealth Management. The Corporate Bank segment offers commercial banking services, such as commercial and industrial, commercial real estate, and investor real estate lending; equipment lease financing; deposit products; and securities underwriting and placement, loan syndication and placement, foreign exchange, derivatives, merger and acquisition, and other advisory services. It serves corporate, middle market, and commercial real estate developers and investors. The Consumer Bank segment provides consumer banking products and services related to residential first mortgages, home equity lines and loans, consumer credit cards, and other consumer loans, as well as deposits. The Wealth Management segment offers credit related products, and retirement and savings solutions; and trust and investment management, asset management, and estate planning services to individuals, businesses, governmental institutions, and non-profit entities. It also provides investment and insurance products; low-income housing tax credit corporate fund syndication services; and other specialty financing services. The company was founded in 1971 and is headquartered in Birmingham, Alabama.",0.0003683606202656269
NYQ,DPZ,Domino's Pizza Inc,"Domino's Pizza, Inc.",Consumer Cyclical,Restaurants,504.52,17571825664,872108032,0.031,Ann Arbor,MI,United States,6500,"Domino's Pizza, Inc., through its subsidiaries, operates as a pizza company in the United States and internationally. The company operates through three segments: U.S. Stores, International Franchise, and Supply Chain. It offers pizzas under the Domino's brand name through company-owned and franchised stores. It also provides oven-baked sandwiches, pastas, boneless chicken and chicken wings, breads and dips, desserts, and soft drink products, as well as loaded tots and pepperoni stuffed cheesy breads. Domino's Pizza, Inc. was founded in 1960 and is headquartered in Ann Arbor, Michigan.",0.0003627940942640808
NYQ,TYL,"Tyler Technologies, Inc.","Tyler Technologies, Inc.",Technology,Software - Application,412.86,17521240064,323408000,0.063,Plano,TX,United States,7300,"Tyler Technologies, Inc. provides integrated information management solutions and services for the public sector. It operates in two segments, Enterprise Software and Platform Technologies. The company offers platform and transformative technology solutions, including cybersecurity for government agencies; data and insights solutions; digital solutions that helps workers and policymakers to share, communicate, and leverage data; payments solutions, such as billing, presentment, merchant onboarding, collections, reconciliation, and disbursements; platform technologies, an application development platform that enables government workers to build solutions and applications; and outdoor recreation solutions, including campsite reservations, activity registrations, licensing sales and renewals, and real-time data for conservation and park management. It also provides public administration solutions, such as civic services; financial applications with human resources, revenue management, tax billing, utilities, asset management, and payment processing; property and recording service that manages appraisal services, valuation, tax billing and collections, assessment administration, and land and official records; and permitting, licensing, and regulatory management solutions. In addition, the company offers courts and public safety solutions; school ERP and student transportation solutions for K-12 schools; and health and human services solutions. Further, the company offers software as a service arrangements and electronic document filing solutions for courts; software and hardware installation, data conversion, training, product modification, and maintenance and support services; and property appraisal outsourcing services for taxing jurisdictions. Tyler Technologies, Inc. has a strategic collaboration agreement with Amazon Web Services for cloud hosting services. The company was founded in 1966 and is headquartered in Plano, Texas.",0.00036174968617093634
NYQ,CNP,"CenterPoint Energy, Inc (Holdin","CenterPoint Energy, Inc.",Utilities,Utilities - Regulated Electric,27.58,17460815872,2972000000,-0.195,Houston,TX,United States,8827,"CenterPoint Energy, Inc. operates as a public utility holding company in the United States. The company operates through two segments, Electric and Natural Gas. The Electric segment includes electric transmission and distribution services to electric customers and electric generation assets, as well as optimizes assets in the wholesale power market. The Natural Gas segment engages in the intrastate natural gas sales, and natural gas transportation and distribution for residential, commercial, industrial and institutional customers in Indiana, Louisiana, Minnesota, Mississippi, Ohio, and Texas; permanent pipeline connections through interconnects with various interstate and intrastate pipeline companies; and provides maintenance and repair services of home appliances to customers in Minnesota and home repair protection plans to natural gas customers in Indiana, Mississippi, Ohio, and Texas through a third party. It serves approximately 2,534,730 metered customers; owned 348 substations with transformer capacity of 79,719 megavolt amperes; and owned and operated 217 miles of intrastate pipeline in Louisiana and Texas. The company was founded in 1866 and is headquartered in Houston, Texas.",0.0003605021470462346
NYQ,VTR,"Ventas, Inc.","Ventas, Inc.",Real Estate,REIT - Healthcare Facilities,43.17,17374283776,1772999040,0.135,Chicago,IL,United States,486,"Ventas Inc. (NYSE: VTR) is a leading S&P 500 real estate investment trust focused on delivering strong, sustainable shareholder returns by enabling exceptional environments that benefit a large and growing aging population. The Company's growth is fueled by its senior housing communities, which provide valuable services to residents and enable them to thrive in supported environments. Ventas leverages its unmatched operational expertise, data-driven insights from its Ventas Operational InsightsTM platform, extensive relationships and strong financial position to achieve its goal of delivering outsized performance across approximately 1,400 properties. The Ventas portfolio is composed of senior housing communities, outpatient medical buildings, research centers and healthcare facilities in North America and the United Kingdom. The Company benefits from a seasoned team of talented professionals who share a commitment to excellence, integrity and a common purpose of helping people live longer, healthier, happier lives.",0.00035871557495103053
