Exchange,Symbol,Shortname,Longname,Sector,Industry,Currentprice,Marketcap,Ebitda,Revenuegrowth,City,State,Country,Fulltimeemployees,Longbusinesssummary,Weight
NYQ,UHS,"Universal Health Services, Inc.","Universal Health Services, Inc.",Healthcare,Medical Care Facilities,168.4,11339078656,1743421952,0.074,King of Prussia,PA,United States,73350,"Universal Health Services, Inc., through its subsidiaries, owns and operates acute care hospitals, and outpatient and behavioral health care facilities. It operates through Acute Care Hospital Services and Behavioral Health Care Services segments. The company's hospitals offer general and specialty surgery, internal medicine, obstetrics, emergency room care, radiology, oncology, diagnostic and coronary care, pediatric services, pharmacy services, and/or behavioral health services. It also provides commercial health insurance services; and various management services, which include central purchasing, information, finance and control systems, facilities planning, physician recruitment, administrative personnel management, marketing, and public relations services. Universal Health Services, Inc. founded in 1978 and is headquartered in King of Prussia, Pennsylvania.",0.00023411060691437842
NMS,FFIV,"F5, Inc.","F5, Inc.",Technology,Software - Infrastructure,192.09,11296082944,725488000,-0.011,Seattle,WA,United States,6071,"F5, Inc. provides multi-cloud application security and delivery solutions in the United States, Europe, the Middle East, Africa, and the Asia Pacific region. The company's distributed cloud services enable its customers to deploy, secure, and operate applications in any architecture, from on-premises to the public cloud. It offers unified, security, networking, and application management solutions, such as web app and API protection; multi-cloud networking; application delivery and deployment; domain name system; content delivery network; and application deployment and orchestration. The company also provides application security and delivery products, including NGINX Plus; NGINX Management Suite; NGINX Ingress Controller; NGINX App Protect; BIG-IP Packaged Software; and BIG-IP Systems. In addition, it provides a range of professional services, including maintenance, consulting, training, and other technical support services. F5, Inc. sells its products to large enterprise businesses, public sector institutions, governments, and service providers through distributors, value-added resellers, managed service providers, systems integrators, and other indirect channel partners. It has partnerships with public cloud providers, such as Amazon Web Services, Microsoft Azure, and Google Cloud Platform. The company was formerly known as F5 Networks, Inc. and changed its name to F5, Inc. in November 2021. F5, Inc. was incorporated in 1996 and is headquartered in Seattle, Washington.",0.0002332229023189341
NMS,QRVO,"Qorvo, Inc.","Qorvo, Inc.",Technology,Semiconductors,115.81,11181281280,499004992,0.445,Greensboro,NC,United States,8500,"Qorvo, Inc. engages in development and commercialization of technologies and products for wireless, wired, and power markets. It operates through three segments: High Performance Analog (HPA), Connectivity and Sensors Group (CSG), and Advanced Cellular Group (ACG). The HPA segment supplies radio frequency and power management solutions for automotive, defense and aerospace, cellular infrastructure, broadband, and other markets. The CSG segment supplies connectivity and sensor components and systems featuring various technologies, such as UWB, Matter, Bluetooth Low Energy, Zigbee, Thread, Wi-Fi, cellular IoT, and MEMS-/BAW-based sensors. It serves markets, such as smart home, industrial automation, automotive, smartphones, wearables, gaming, and industrial and enterprise access points. The ACG segment supplies cellular RF solutions for smartphones, wearables, laptops, tablets, and various other devices. The company also offers foundry services for defense primes and other defense and aerospace customers. The company sells its products directly to original equipment manufacturers and original design manufacturers, as well as through a network of sales representative firms and distributors. It operates in the United States, China, other Asian countries, Taiwan, and Europe. The company was founded in 1957 and is headquartered in Greensboro, North Carolina.",0.0002308526667778305
NYQ,HII,"Huntington Ingalls Industries, ","Huntington Ingalls Industries, Inc.",Industrials,Aerospace & Defense,276.31,10944224256,1119000064,0.13,Newport News,VA,United States,44000,"Huntington Ingalls Industries, Inc. designs, builds, overhauls, and repairs military ships in the United States. It operates through three segments: Ingalls, Newport News, and Mission Technologies. The company is involved in the design and construction of non-nuclear ships comprising amphibious assault ships; expeditionary warfare ships; surface combatants; and national security cutters for the U.S. Navy and U.S. Coast Guard. It also provides nuclear-powered ships, such as aircraft carriers and submarines, as well as refueling and overhaul, and inactivation services of nuclear-powered aircraft carriers. In addition, the company offers naval nuclear support services, including fleet services comprising design, construction, maintenance, and disposal activities for in-service the U.S. Navy nuclear ships; and maintenance services on nuclear reactor prototypes. Further, the company provides C5ISR systems and operations; application of artificial intelligence and machine learning to battlefield decisions; defensive and offensive cyberspace strategies and electronic warfare; live, virtual, and constructive solutions; unmanned, autonomous systems; and fleet sustainment; and critical nuclear operations. Huntington Ingalls Industries, Inc. was founded in 1886 and is headquartered in Newport News, Virginia.",0.00022595830406586622
NYQ,SOLV,Solventum Corporation,Solventum Corporation,Healthcare,Health Information Services,63.17,10910026752,2248999936,0.015,Saint Paul,MN,United States,,"Solventum Corporation, a healthcare company, engages in the developing, manufacturing, and commercializing a portfolio of solutions to address critical customer and patient needs. It operates through four segments: Medsurg, Dental Solutions, Health Information Systems, and Purification and Filtration. The Medsurg segment is a provider of solutions including advanced wound care, I.V. site management, sterilization assurance, temperature management, surgical supplies, stethoscopes, and medical electrodes. The Dental Solutions segment provides a comprehensive suite of dental and orthodontic products including brackets, aligners, restorative cements, and bonding agents. The Health Information Systems provides software solutions including computer-assisted, physician documentation, direct-to-bill and coding automation, classification methodologies, speech, recognition, and data visualization platforms. The Purification and Filtration segment provides purification and filtration technologies including filters, purifiers, cartridges, and membranes. The company was incorporated in 2023 and is based in Saint Paul, Minnesota.",0.0002252522503679178
NMS,REG,Regency Centers Corporation,Regency Centers Corporation,Real Estate,REIT - Retail,58.19,10816414720,839577024,0.182,Jacksonville,FL,United States,492,"Regency Centers is a preeminent national owner, operator, and developer of shopping centers located in suburban trade areas with compelling demographics. Our portfolio includes thriving properties merchandised with highly productive grocers, restaurants, service providers, and best-in-class retailers that connect to their neighborhoods, communities, and customers. Operating as a fully integrated real estate company, Regency Centers is a qualified real estate investment trust (REIT) that is self-administered, self-managed, and an S&P 500 Index member.",0.000223319503423402
NMS,TECH,Bio-Techne Corp,Bio-Techne Corporation,Healthcare,Biotechnology,68.81,10816380928,323364992,0.004,Minneapolis,MN,United States,3200,"Bio-Techne Corporation, together with its subsidiaries, develops, manufactures, and sells life science reagents, instruments, and services for the research and clinical diagnostic markets in the United States, the United Kingdom, rest of Europe, Middle East, and Africa, Greater China, rest of Asia-Pacific, and internationally. The company operates through two segments, Protein Sciences, and Diagnostics and Genomics. The Protein Sciences segment develops and manufactures biological reagents used in various aspects of life science research, diagnostics, and cell and gene therapy, such as cytokines and growth factors, antibodies, small molecules, tissue culture sera, and cell selection technologies. This segment also offers proteomic analytical tools for automated western blot and multiplexed ELISA workflow consists of manual and automated protein analysis instruments and immunoassays for use in quantifying proteins in various biological fluids. The Diagnostics and Genomics segment develops and manufactures diagnostic products, including controls, calibrators, and diagnostic assays for regulated diagnostics market, exosome-based molecular diagnostic assays, advanced tissue-based in-situ hybridization assays for spatial genomic and tissue biopsy analysis, and genetic and oncology kits for research and clinical applications; and sells products for genetic carrier screening, oncology diagnostics, molecular controls, and research, as well as instruments and process control products for hematology, blood chemistry and gases, and coagulation controls and reagents used in various diagnostic applications. The company was formerly known as Techne Corporation and changed its name to Bio-Techne Corporation in November 2014. Bio-Techne Corporation was incorporated in 1976 and is headquartered in Minneapolis, Minnesota.",0.0002233188057418823
NYQ,CPT,Camden Property Trust,Camden Property Trust,Real Estate,REIT - Residential,99.94,10670493696,899507968,0.032,Houston,TX,United States,1640,"Camden Property Trust, an S&P 500 Company, is a real estate company primarily engaged in the ownership, management, development, redevelopment, acquisition, and construction of multifamily apartment communities. Camden owns and operates 172 properties containing 58,634 apartment homes across the United States. Upon completion of 4 properties currently under development, the Company's portfolio will increase to 59,800 apartment homes in 176 properties. Camden has been recognized as one of the 100 Best Companies to Work For by FORTUNE magazine for 16 consecutive years, most recently ranking #33.",0.00022030676662823645
NYQ,RL,Ralph Lauren Corporation,Ralph Lauren Corporation,Consumer Cyclical,Apparel Manufacturing,165.02,10549003264,974200000,0.056,New York,NY,United States,14900,"Ralph Lauren Corporation designs, markets, and distributes lifestyle products in North America, Europe, Asia, and internationally. The company offers apparel, including a range of men's, women's, and children's clothing; footwear and accessories, which comprise casual shoes, dress shoes, boots, sneakers, sandals, eyewear, watches, fashion and fine jewelry, scarves, hats, gloves, and umbrellas, as well as leather goods, such as handbags, luggage, small leather goods, and belts; home products consisting of bed and bath lines, furniture, fabric and wallcoverings, lighting, tabletop, kitchen linens, floor coverings, and giftware; and fragrances. It sells apparel and accessories under the Ralph Lauren Collection, Ralph Lauren Purple Label, Polo Ralph Lauren, Double RL, Lauren Ralph Lauren, Polo Golf Ralph Lauren, Ralph Lauren Golf, RLX Ralph Lauren, Polo Ralph Lauren Children, and Chaps brands; women's fragrances under the Ralph Lauren Collection, Woman by Ralph Lauren, Romance Collection, and Ralph Collection brand names; and men's fragrances under the Polo Blue, Ralph's Club, Safari, Purple Label, Polo Red, Polo Green, Polo Black, Polo Sport, and Big Pony Men's brand names. The company's restaurant collection includes The Polo Bar in New York City; RL Restaurant in Chicago; Ralph's in Paris; The Bar at Ralph Lauren located in Milan; and Ralph's Coffee concept. It sells its products to department stores, specialty stores, and golf and pro shops, as well as directly to consumers through its retail stores, concession-based shop-within-shops, and its digital commerce sites. The company directly operates retail stores and concession-based shop-within-shops; and operates Ralph Lauren stores, factory stores, and stores and shops through licensing partners. Ralph Lauren Corporation was founded in 1967 and is headquartered in New York, New York.",0.00021779843242995835
NYQ,BBWI,"Bath & Body Works, Inc.","Bath & Body Works, Inc.",Consumer Cyclical,Specialty Retail,46.22,10394739712,1554000000,0.008,Columbus,OH,United States,8981,"Bath & Body Works, Inc. operates a specialty retailer of home fragrance, body care, and soaps and sanitizer products. It sells its products under the Bath & Body Works, White Barn, and other brand names through retail stores and e-commerce sites located in the United States and Canada, as well as through international stores operated by partners under franchise, license, and wholesale arrangements. The company was formerly known as L Brands, Inc. and changed its name to Bath & Body Works, Inc. in August 2021. Bath & Body Works, Inc. was founded in 1963 and is headquartered in Columbus, Ohio.",0.0002146134528668809
NMS,APA,APA Corporation,APA Corporation,Energy,Oil & Gas E&P,34.4,10373423104,5103000064,-0.154,Houston,TX,United States,2271,"APA Corporation, an independent energy company, explores for, develops, and produces natural gas, crude oil, and natural gas liquids. It has oil and gas operations in the United States, Egypt, and North Sea. The company also has exploration and appraisal activities in Suriname, as well as holds interests in projects located in Uruguay and internationally. APA Corporation was incorporated in 1954 and is headquartered in Houston, Texas.",0.0002141733426791281
NYQ,MOS,Mosaic Company (The),The Mosaic Company,Basic Materials,Agricultural Inputs,32.08,10319783936,2337799936,-0.297,Tampa,FL,United States,14049,"The Mosaic Company, through its subsidiaries, produces and markets concentrated phosphate and potash crop nutrients in North America and internationally. The company operates through three segments: Phosphates, Potash, and Mosaic Fertilizantes. It owns and operates mines, which produce concentrated phosphate crop nutrients, such as diammonium phosphate, monoammonium phosphate, and ammoniated phosphate products; and phosphate-based animal feed ingredients primarily under the Biofos and Nexfos brand names, as well as produces a double sulfate of potash magnesia product under K-Mag brand name. The company also produces and sells potash for use in the manufacturing of mixed crop nutrients and animal feed ingredients, and for industrial use; and for use in the de-icing and as a water softener regenerant. In addition, it provides nitrogen-based crop nutrients, animal feed ingredients, and other ancillary services; and purchases and sells phosphates, potash, and nitrogen products. The company sells its products to wholesale distributors, retail chains, farmers, cooperatives, independent retailers, and national accounts. The company was incorporated in 2004 and is headquartered in Tampa, Florida.",0.00021306588954683877
NYQ,CTLT,"Catalent, Inc.","Catalent, Inc.",Healthcare,Drug Manufacturers - Specialty & Generic,56.92,10287606784,327000000,-0.109,Somerset,NJ,United States,18000,"Catalent, Inc., together with its subsidiaries, develops and manufactures solutions for drugs, protein-based biologics, cell and gene therapies, and consumer health products worldwide. It operates in two segments, Biologics, and Pharma and Consumer Health. The Biologics segment provides formulation, development, and manufacturing for biologic proteins, cell gene, and other nucleic acid therapies; pDNA, iPSCs, oncolytic viruses, and vaccines; formulation, development, and manufacturing for parenteral dose forms, including vials, prefilled syringes, and cartridges; and analytical development and testing services for large molecules. The Pharma and Consumer Health segment offers formulation, development, and manufacturing services for soft capsules for use in a range of customer products, such as prescription drugs, over-the-counter medications, dietary supplements, unit-dose cosmetics, and animal health medicinal preparations; and oral, nasal, inhaled, and topical dose forms. This segment also provides clinical supply services through manufacturing, packaging, storage, distribution, and inventory management for small-molecule drugs, protein-based biologics, and cell and gene therapies in clinical trials; and pre-clinical screening, formulation, analytical development, and current good manufacturing practices manufacturing at clinical and commercial scale for softgel capsule, Zydis fast-dissolve tablets, oral solid-dose formats, dry powder inhalers, and nasal delivery devices. The company also offers FlexDirect direct-to-patient and FastChain demand-led clinical supply solutions; fill and finish operations for injectable products; and integrated development and product supply chain solutions. It serves pharmaceutical, biotechnology, and consumer health companies; and companies in other healthcare market segments, such as animal health and medical devices, as well as in cosmetics industries. The company was founded in 1933 and is headquartered in Somerset, New Jersey.",0.0002124015487470234
NYQ,TFX,Teleflex Incorporated,Teleflex Incorporated,Healthcare,Medical Instruments & Supplies,217.42,10240742400,743744000,0.021,Wayne,PA,United States,14500,"Teleflex Incorporated designs, develops, manufactures, and supplies single-use medical devices for common diagnostic and therapeutic procedures in critical care and surgical applications worldwide. The company provides vascular access products that comprise Arrow branded catheters, catheter navigation and tip positioning systems, and intraosseous access systems for the administration of intravenous therapies, the measurement of blood pressure, and the withdrawal of blood samples through a single puncture site. It also offers interventional products, which consists of various coronary catheters, structural heart support devices, and peripheral intervention and mechanical circulatory support platform that are used by interventional cardiologists and radiologists, and vascular surgeons; and Arrow branded pumps and catheters, Guideline, Turnpike, and Trapliner catheters, the Manta Vascular Closure, and Arrow Oncontrol devices. The company provides anesthesia products, such as airway and pain management products to support hospital, emergency medicine, and military channels; and surgical products, including metal and polymer ligation clips, and fascial closure surgical systems that are used in laparoscopic surgical procedures, percutaneous surgical systems, and other surgical instruments. It also offers interventional urology products comprising the UroLift System, an invasive technology for treating lower urinary tract symptoms due to benign prostatic hyperplasia; respiratory products, including oxygen and aerosol therapies, spirometry, and ventilation management products for use in various care settings; urology products, such as catheters, urine collectors, and catheterization accessories and products for operative endourology; and bladder management services. The company serves hospitals and healthcare providers, medical device manufacturers, and home care markets. Teleflex Incorporated was incorporated in 1943 and is headquartered in Wayne, Pennsylvania.",0.0002114339701885042
NYQ,DAY,"Dayforce, Inc.",Dayforce Inc,Technology,Software - Application,62.77,9764626432,212900000,0.189,Minneapolis,MN,United States,9084,"Dayforce Inc., together with its subsidiaries, operates as a human capital management (HCM) software company in the United States, Canada, and internationally. It offers Dayforce, a cloud HCM platform that provides human resources, payroll and tax, workforce management, wallet, benefits, and talent intelligence functionalities; and Powerpay, a cloud HR and payroll solution for the small business market. The company also provides payroll and payroll-related services; and implementation and professional services. It sells its solutions through direct sales force and third-party channels. The company was formerly known as Ceridian HCM Holding Inc. and changed its name to Dayforce Inc. in February 2024. Dayforce Inc. was founded in 1992 and is headquartered in Minneapolis, Minnesota.",0.00020160391241999878
NYQ,BXP,"Boston Properties, Inc.","Boston Properties, Inc.",Real Estate,REIT - Office,62.03,9739393024,1845555968,0.348,Boston,MA,United States,836,"Boston Properties, Inc. (NYSE: BXP) (BXP or the Company) is the largest publicly traded developer, owner, and manager of premier workplaces in the United States, concentrated in six dynamic gateway markets - Boston, Los Angeles, New York, San Francisco, Seattle, and Washington, DC. BXP has delivered places that power progress for our clients and communities for more than 50 years. BXP is a fully integrated real estate company, organized as a real estate investment trust (REIT). Including properties owned by joint ventures, BXP's portfolio totals 53.3 million square feet and 188 properties, including 10 properties under construction/redevelopment. BXP's properties include 167 office properties, 14 retail properties (including two retail properties under construction/redevelopment), six residential properties (including one residential property under construction) and one hotel. BXP is well-known for its inhouse building management expertise and responsiveness to clients' needs. BXP holds a superior track record of developing premium Central Business District (CBD) office buildings, successful mixed-use complexes, suburban office centers and build-to-suit projects for a diverse array of creditworthy clients. BXP actively works to promote its growth and operations in a sustainable and responsible manner. BXP has earned a twelfth consecutive GRESB Green Star recognition and the highest GRESB 5-star Rating. BXP, an S&P 500 company, was founded in 1970 by Mortimer B. Zuckerman and Edward H. Linde and became a public company in 1997.",0.00020108293460155213
NYQ,TPR,"Tapestry, Inc.","Tapestry, Inc.",Consumer Cyclical,Luxury Goods,41.82,9592086528,1428000000,0.029,New York,NY,United States,12600,"Tapestry, Inc. provides luxury accessories and branded lifestyle products in the United States, Japan, Greater China, and internationally. The company operates in three segments: Coach, Kate Spade, and Stuart Weitzman. It offers women's handbags; and women's accessories, such as small leather goods which includes mini and micro handbags, money pieces, wristlets, pouches, and cosmetic cases, as well as novelty accessories including address books, time management and travel accessories, sketchbooks, and portfolios; and belts, key rings, and charms. The company also provides men products, which includes bag collections, such as business cases, computer bags, messenger-style bags, backpacks, and totes; small leather goods including wallets, card cases, travel organizers, and belts; and footwear, watches, fragrances, sunglasses, novelty accessories, and ready-to-wear items. In addition, it offers other products including women's footwear and fragrances; eyewear and sunglasses; and jewelry, such as bracelets, necklaces, rings, and earrings, watches, and other women's seasonal lifestyle apparel collections, including outerwear, ready-to-wear and cold weather accessories, such as gloves, scarves, and hats. Further, the company provides kids items, housewares, and home accessories, such as fashion bedding and tableware, stationery, and gifts. It offers its products through e-commerce sites and concession shop-in-shops, wholesale, and third-party distributors under the Coach, Kate Spade, and Stuart Weitzman brand names. The company was formerly known as Coach, Inc. and changed its name to Tapestry, Inc. in October 2017. Tapestry, Inc. was founded in 1941 and is headquartered in New York, New York.",0.00019804159286407837
