Exchange,Symbol,Shortname,Longname,Sector,Industry,Currentprice,Marketcap,Ebitda,Revenuegrowth,City,State,Country,Fulltimeemployees,Longbusinesssummary,Weight
NMS,VTRS,Viatris Inc.,Viatris Inc.,Healthcare,Drug Manufacturers - Specialty & Generic,11.57,13740185600,4856900096,-0.01,Canonsburg,PA,United States,38000,"Viatris Inc. operates as a healthcare company worldwide. The company operates in four segments: Developed Markets, Greater China, JANZ, and Emerging Markets. It offers prescription brand drugs, generic drugs, complex generic drugs, biosimilars, and active pharmaceutical ingredients (APIs). The company offers drugs in various therapeutic areas, including noncommunicable and infectious diseases; biosimilars in the areas of oncology, immunology, endocrinology, ophthalmology, and dermatology; and APIs for antibacterial, central nervous system agents, antihistamines/antiasthmatics, cardiovascular, antivirals, antidiabetics, antifungals, and proton pump inhibitor areas, as well as support services, such as diagnostic clinics, educational seminars, and digital tools to help patients better manage their health. It provides it medicines in the form of oral solid doses, injectables, complex dosage forms, and APIs to retail and pharmacy establishments, wholesalers and distributors, payers, insurers and governments, and institutions. The company distributes its products through pharmaceutical wholesalers/distributors, pharmaceutical retailers, institutional pharmacies, mail-order and e-commerce pharmacies, and specialty pharmacies. It sells its products under the Lyrica, Lipitor, Creon, Influvac, Wixela Inhub, EpiPen auto-injector, Fraxiparine, and Yupelri; Norvasc and Viagra; AMITIZA, Lipacreon, and Effexor; and Celebrex and ARV names, as well as glargine and SEMGLEE names. The company has collaboration and licensing agreements with Revance Therapeutics, Inc.; and Momenta Pharmaceuticals, Inc. Viatris Inc. was founded in 1961 and is headquartered in Canonsburg, Pennsylvania.",0.00028368470556733414
NYQ,KEY,KeyCorp,KeyCorp,Financial Services,Banks - Regional,14.72,13652387840,,-0.121,Cleveland,OH,United States,17333,"KeyCorp operates as the holding company for KeyBank National Association that provides various retail and commercial banking products and services in the United States. It operates in two segments, Consumer Bank and Commercial Bank. The company offers various deposits, investment products and services; commercial leasing, investment management, consumer finance; and personal finance and financial wellness, student loan refinancing, mortgage and home equity, lending, credit card, treasury, business advisory, wealth management, asset management, cash management, portfolio management, and trust and related services to individuals and small and medium-sized businesses. It also provides a suite of banking and capital market products, such as syndicated finance, debt and equity capital market products, commercial payments, equipment finance, commercial mortgage banking, derivatives, foreign exchange, financial advisory, and public finance, as well as commercial mortgage loans to consumer, energy, healthcare, industrial, public sector, real estate, and technology sectors for middle market clients. In addition, the company offers community development financing, securities underwriting, brokerage, and investment banking services. The company was founded in 1849 and is headquartered in Cleveland, Ohio.",0.00028187200212793727
NYQ,PNR,Pentair plc.,Pentair plc,Industrials,Specialty Industrial Machinery,81.78,13576787968,897000000,-0.018,London,,United Kingdom,10500,"Pentair plc provides various water solutions in the United States, Western Europe, China, Eastern Europe, Latin America, the Middle East, Southeast Asia, Australia, Canada, and Japan. The company operates through three segments: Flow, Water Solutions, and Pool. The Flow segment designs, manufactures, and sells fluid treatment and pump products and systems, including pressure vessels, gas recovery solutions, membrane bioreactors, wastewater reuse systems and advanced membrane filtration, separation systems, water disposal pumps, water supply pumps, fluid transfer pumps, turbine pumps, solid handling pumps, and agricultural spray nozzles for fluid delivery, ion exchange, desalination, food and beverage, separation technologies in the oil and gas industry, residential and municipal wells, water treatment, wastewater solids handling, pressure boosting, circulation and transfer, fire suppression, flood control, agricultural irrigation, and crop spray in residential, commercial, and industrial markets. The Water Solutions segment provides commercial and residential water treatment products and systems, including pressure tanks, control valves, activated carbon products, commercial ice machines, conventional filtration products, and point-of-entry and point-of-use water treatment systems, as well as installation and preventative services for use in residential whole home water filtration, drinking water filtration, and water softening solutions, as well as commercial total water management and filtration in foodservice operations. The Pool segment provides residential and commercial pool equipment and accessories comprising pumps, filters, heaters, lights, automatic controls, automatic cleaners, maintenance equipment, and pool accessories for applications in residential and commercial pool maintenance, pool repair, renovation, service, and construction and aquaculture solutions. Pentair plc was founded in 1966 and is headquartered in London, the United Kingdom.",0.0002803111405752921
NYQ,RVTY,"Revvity, Inc.","Revvity, Inc.",Healthcare,Diagnostics & Research,108.5,13402462208,813252992,-0.061,Waltham,MA,United States,11500,"Revvity, Inc. provides health sciences solutions, technologies, and services in the Americas, Europe, and Asia, and internationally. The Life Sciences segment provides instruments, reagents, informatics, software, subscriptions, detection, imaging technologies, warranties, training, and services. Its Diagnostics segment provides instruments, reagents, assay platforms, and software products for the early detection of genetic disorders, such as pregnancy and early childhood, as well as infectious disease testing in the diagnostics market. Its products are used for testing and screening genetic abnormalities, disorders, and diseases, including down syndrome, hypothyroidism, muscular dystrophy, infertility, and various metabolic conditions. This segment also develops technologies that enable and support genomic workflows using protein coupled receptor and next-generation DNA sequencing for applications in oncology, immunodiagnostics, and drug discovery. It serves pharmaceutical and biotechnology companies, laboratories, academic and research institutions, public health authorities, private healthcare organizations, doctors, and government agencies under the AutoDELFIA, BACS-on-Beads, BIOCHIPs, Bioo Scientific,BoBs , chemagic, Chitas, DELFIA, DELFIA Xpress, DOPlify, EONIS, EUROArray, EUROIMMUN, EUROLabWorkstation, EUROLINE, EUROPattern, Evolution Evoya, explorer, Fontus, Genoglyphix, GSP, Haoyuan, IDS, IDS-i10 IDS-i10T, IDS-iSYS, iLab, iQ, JANUS, LabChip, LifeCycle, LimsLink, Migele, MultiPROBE, NEXTFLEX, NextPrep, Pannoramic, Panthera Puncher, PG-Seq, PGFind PKamp, PreNAT II, Prime, Protein Clear, ProteinEXact, QSigh, QuantiVac, RONIA, Sciclone, SimplicityChrom, Specimen Gate,Superflex, Symbio, T-SPOT, Touch, Twister, Vanadis, VariSpec, ViaCord VICTOR 2D, and Zephyr brand name. The company was formerly known as PerkinElmer, Inc. and changed its name to Revvity, Inc. in April 2023. Revvity, Inc. was founded in 1937 and is headquartered in Waltham, Massachusetts.",0.00027671194960814815
NMS,GEN,Gen Digital Inc.,Gen Digital Inc.,Technology,Software - Infrastructure,20.99,13368740864,1858000000,0.016,Tempe,AZ,United States,3700,"Gen Digital Inc. provides cyber safety solutions for consumers in the United States, Canada, Latin America, Europe, the Middle East, Africa, the Asia Pacific, and Japan. It offers security and performance products comprising that provide real-time protection for PCs, Macs and mobile devices against malware, viruses, adware, and other online threats; and Norton and LifeLock identity theft protection solution that offers monitoring, alerts, and restoration services to its customers. The company also provides Dark Web Monitoring product, which looks for personal information of its members on the Dark Web; Avast Secure Identity that provides advanced identity protection including credit monitoring and alerts; LifeLock Home Title Protect that detects fraud and notifies members; and Norton Social Media Monitoring that help keep customers' social media accounts safer by monitoring them for account takeovers, risky activity, and inappropriate content. In addition, it offers VPN solution, which enhances security and online privacy by providing an encrypted data tunnel;Norton Privacy Monitor Assistant, an on-demand, white glove service where agents help members delete personal information from data brokers online; Avira Security, a consumer-focused portfolio of cybersecurity and privacy solutions; AntiTrack product, which helps to keep personal information and browsing activity private by blocking trackers and disguising digital fingerprints online; and Online Reputation Management solution that manages online search results, personal branding, and digital privacy. It markets and sells its products and related services through retailers, telecom service providers, hardware original equipment manufacturers, and employee benefit providers, as well as e-commerce platform. The company was formerly known as NortonLifeLock Inc. and changed its name to Gen Digital Inc. in November 2022. Gen Digital Inc. was founded in 1982 and is based in Tempe, Arizona.",0.0002760157268770684
NMS,LKQ,LKQ Corporation,LKQ Corporation,Consumer Cyclical,Auto Parts,49.99,13327684608,1744000000,0.167,Chicago,IL,United States,49000,"LKQ Corporation engages in the distribution of replacement parts, components, and systems used in the repair and maintenance of vehicles and specialty vehicle aftermarket products and accessories. It operates through four segments: Wholesale-North America, Europe, Specialty, and Self Service. The company distributes bumper covers, automotive body panels, and lights, as well as mechanical automotive parts and accessories; salvage products, including mechanical and collision parts comprising engines; transmissions; door assemblies; sheet metal products, such as trunk lids, fenders, and hoods; lights and bumper assemblies; scrap metal and other materials to metals recyclers; and brake pads, discs and sensors, clutches, steering and suspension products, filters, and oil and automotive fluids, as well as electrical products, including spark plugs and batteries. In addition, the company distributes recreational vehicle appliances and air conditioners, towing hitches, truck bed covers, vehicle protection products, marine electronics, cargo management products, wheels, tires, and suspension products. It serves collision and mechanical repair shops, and new and used car dealerships, as well as retail customers. The company operates in the United States, Canada, the United Kingdom, Germany, Belgium, the Netherlands, Luxembourg, Italy, the Czech Republic, Austria, Poland, Slovakia, Taiwan, and other European countries. LKQ Corporation was incorporated in 1998 and is headquartered in Chicago, Illinois.",0.0002751680649724827
NYQ,DOC,"Healthpeak Properties, Inc.","Healthpeak Properties, Inc.",Real Estate,REIT - Healthcare Facilities,18.68,13254898688,1151196032,0.056,Denver,CO,United States,193,"Healthpeak Properties, Inc. is a fully integrated real estate investment trust (REIT) and S&P 500 company. Healthpeak owns, operates, and develops high-quality real estate for healthcare discovery and delivery.",0.00027366530126275175
NYQ,UDR,"UDR, Inc.","UDR, Inc.",Real Estate,REIT - Residential,37.17,13220662272,1004284032,-0.046,Highlands Ranch,CO,United States,1397,"UDR, Inc. (NYSE: UDR), an S&P 500 company, is a leading multifamily real estate investment trust with a demonstrated performance history of delivering superior and dependable returns by successfully managing, buying, selling, developing and redeveloping attractive real estate communities in targeted U.S. markets. As of December 31, 2023, UDR owned or had an ownership position in 60,336 apartment homes including 359 homes under development. For over 51 years, UDR has delivered long-term value to shareholders, the best standard of service to Residents and the highest quality experience for Associates.",0.00027295844417396243
NYQ,AMCR,Amcor plc,Amcor plc,Consumer Cyclical,Packaging & Containers,9.07,13109233664,1808000000,-0.107,Zurich,,Switzerland,41000,"Amcor plc develops, produces, and sells packaging products in Europe, North America, Latin America, Africa, and the Asia Pacific regions. The company operates through two segments, Flexibles and Rigid Packaging. The Flexibles segment provides flexible and film packaging products in the food and beverage, medical and pharmaceutical, fresh produce, snack food, personal care, and other industries. The Rigid Packaging segment offers rigid containers for various beverage and food products, including carbonated soft drinks, water, juices, sports drinks, milk-based beverages, spirits and beer, sauces, dressings, spreads, and personal care items; and plastic caps for various applications. The company sells its products through its direct sales force. Amcor plc was incorporated in 2018 and is headquartered in Zurich, Switzerland.",0.0002706578499336446
NYQ,IP,International Paper Company,International Paper Company,Consumer Cyclical,Packaging & Containers,37.81,13083659264,2148999936,-0.104,Memphis,TN,United States,39000,"International Paper Company produces and sells renewable fiber-based packaging and pulp products in North America, Latin America, Europe, and North Africa. It operates through two segments, Industrial Packaging and Global Cellulose Fibers. The company offers linerboard, medium, whitetop, recycled linerboard, recycled medium and saturating kraft; and pulp for a range of applications, such as diapers, towel and tissue products, feminine care, incontinence, and other personal care products, as well as specialty pulps for use in textiles, construction materials, paints, coatings, and others. It sells its products directly to end users and converters, as well as through agents, resellers, and distributors. The company was founded in 1898 and is headquartered in Memphis, Tennessee.",0.00027012983187440815
NYQ,CPB,Campbell Soup Company,Campbell Soup Company,Consumer Defensive,Packaged Foods,43.21,12881031168,1742000000,-0.012,Camden,NJ,United States,14500,"Campbell Soup Company, together with its subsidiaries, manufactures and markets food and beverage products in the United States and internationally. The company operates through Meals & Beverages and Snacks segments. The Meals & Beverages segment engages in the retail and foodservice businesses in the United States and Canada. This segment provides Campbell's condensed and ready-to-serve soups; Swanson broth and stocks; Pacific Foods broth, soups, and non-dairy beverages; Prego pasta sauces; Pace Mexican sauces; Campbell's gravies, pasta, beans, and dinner sauces; Swanson canned poultry; V8 juices and beverages; Campbell's tomato juice; and snacking products in foodservice in Canada. The Snacks segment retails Pepperidge Farm cookies, crackers, fresh bakery, and frozen products, that includes Goldfish crackers, Snyder's of Hanover pretzels, Lance sandwich crackers, Cape Cod and Kettle Brand potato chips, Late July snacks, Snack Factory pretzel crisps, Pop Secret popcorn, and other snacking products. This segment is also involved in the retail business in Latin America. It sells its products through retail food chains, mass discounters and merchandisers, club stores, convenience stores, drug stores, and dollar stores, as well as e-commerce and other retail, commercial, and non-commercial establishments, and independent contractor distributors. The company was founded in 1869 and is headquartered in Camden, New Jersey.",0.00026594630092170913
NYQ,CRL,Charles River Laboratories Inte,"Charles River Laboratories International, Inc.",Healthcare,Diagnostics & Research,246.42,12693291008,970294016,-0.079,Wilmington,MA,United States,20400,"Charles River Laboratories International, Inc. provides drug discovery, non-clinical development, and safety testing services in the United States, Europe, Canada, the Asia Pacific, and internationally. It operates through three segments: Research Models and Services (RMS), Discovery and Safety Assessment (DSA), and Manufacturing Solutions (Manufacturing). The RMS segment produces and sells rodents, and purpose-bred rats and mice for use by researchers. This segment also provides a range of services to assist its clients in supporting the use of research models in research and screening pre-clinical drug candidates, including research models, genetically engineered models and services, insourcing solutions, and research animal diagnostic services. The DSA segment offers early and in vivo discovery services for the identification and validation of novel targets, chemical compounds, and antibodies through delivery of preclinical drug and therapeutic candidates ready for safety assessment; and safety assessment services, such as toxicology, pathology, safety pharmacology, bioanalysis, drug metabolism, and pharmacokinetics services. The Manufacturing segment provides in vitro methods for conventional and rapid quality control testing of sterile and non-sterile pharmaceuticals and consumer products. This segment also offers specialized testing of biologics that are outsourced by pharmaceutical and biotechnology companies. It also provides contract vivarium operation services to biopharmaceutical clients. The company was founded in 1947 and is headquartered in Wilmington, Massachusetts.",0.00026207015153310376
NYQ,AOS,A.O. Smith Corporation,A. O. Smith Corporation,Industrials,Specialty Industrial Machinery,86.15,12669477888,819200000,0.056,Milwaukee,WI,United States,12000,"A. O. Smith Corporation manufactures and markets residential and commercial gas and electric water heaters, boilers, heat pumps, tanks, and water treatment products in North America, China, Europe, and India. The company offers water heaters for residences, restaurants, hotels, office buildings, laundries, car washes, and small businesses; boilers for hospitals, schools, hotels, and other large commercial buildings, as well as homes, apartments, and condominiums; and water treatment products comprising point-of-entry water softeners, well water solutions, and whole-home water filtration products, and point-of-use carbon and reverse osmosis products for residences, restaurants, hotels, and offices. It also provides commercial water treatment and filtration product; expansion tanks, commercial solar water heating systems, swimming pool and spa heaters, and related products and parts; and electric wall-hung, gas tankless, combi-boiler, and heat pump and solar water heaters. The company offers its products under the A. O. Smith, State, Lochinvar, Hague, Water-Right, Master Water, Atlantic Filter, and Water Tec brands. It distributes its products through independent wholesale plumbing distributors, as well as to retail channels consisting of hardware and home center chains, and manufacturer representative firms; and offers Aquasana branded products directly to consumers through e-commerce channels. A. O. Smith Corporation was founded in 1874 and is headquartered in Milwaukee, Wisconsin.",0.00026157849748034923
NYQ,AES,The AES Corporation,The AES Corporation,Utilities,Utilities - Diversified,17.82,12666598400,3364999936,-0.03,Arlington,VA,United States,9600,"The AES Corporation, together with its subsidiaries, operates as a diversified power generation and utility company in the United States and internationally. The company owns and/or operates power plants to generate and sell power to customers, such as utilities, industrial users, and other intermediaries; owns and/or operates utilities to generate or purchase, distribute, transmit, and sell electricity to end-user customers in the residential, commercial, industrial, and governmental sectors; and generates and sells electricity on the wholesale market. It uses various fuels and technologies to generate electricity, such as coal, gas, hydro, wind, solar, and biomass, as well as renewables comprising energy storage and landfill gas. The company owns and/or operates a generation portfolio of approximately 34,596 megawatts and distributes power to 2.6 million customers. The company was formerly known as Applied Energy Services, Inc. and changed its name to The AES Corporation in April 2000. The AES Corporation was incorporated in 1981 and is headquartered in Arlington, Virginia.",0.00026151904655812404
NYQ,WRK,Westrock Company,WestRock Company,Consumer Cyclical,Packaging & Containers,49.14,12627358720,2710000128,-0.062,Atlanta,GA,United States,56100,"WestRock Company, together with its subsidiaries, provides fiber-based paper and packaging solutions in North America, South America, Europe, Asia, and Australia. It operates through four segments: Corrugated Packaging, Consumer Packaging, Global Paper, and Distribution. The Corrugated Packaging segment produces containerboards, corrugated sheets, corrugated packaging, and preprinted linerboards to consumer and industrial products manufacturers, and corrugated box manufacturers. It also provides structural and graphic design, engineering services and custom, and proprietary and standard automated packaging machines; turn-key installation, automation, line integration, and packaging solutions; machinery solution that creates pouches; and pack temporary displays, as well as lithographic laminated packaging products. The Consumer Packaging segment manufactures and sells folding cartons that are used to package food, paper, beverages, dairy products, confectionery, health and beauty, and other household consumer products, as well as express mail packages for the overnight courier industry. It also offers inserts and labels, as well as rigid packaging and other printed packaging products, such as transaction cards, brochures, product literature, marketing materials, and grower tags, and plant stakes; and paperboard packaging for over-the-counter and prescription drugs. In addition, this segment manufactures and sells solid fiber and corrugated partitions, and die-cut paperboard components. The Global Paper segment manufactures containerboard, paperboard, and specialty grades primarily to corrugated packaging, folding carton, food service, liquid packaging, tobacco, and commercial print markets. The Distribution segment distributes corrugated packaging materials and other specialty packaging products, including stretch films, void fills, carton sealing tapes, and other specialty tapes; and provides contract packing services. The company is based in Atlanta, Georgia.",0.00026070889032068893
NMS,PODD,Insulet Corporation,Insulet Corporation,Healthcare,Medical Devices,179.65,12579540992,308600000,0.379,Acton,MA,United States,3000,"Insulet Corporation develops, manufactures, and sells insulin delivery systems for people with insulin-dependent diabetes. The company's Omnipod platform includes the Omnipod 5 Automated Insulin Delivery System (Omnipod 5) which includes a proprietary AID algorithm embedded in the Pod that integrates with a third-party continuous glucose monitor to obtain glucose values through wireless bluetooth communication; Omnipod DASH that features a bluetooth enabled Pod that is controlled by a smartphone-like Personal Diabetes Manager with a color touch screen user interface; and Omnipod GO, a standalone, wearable, insulin delivery system that provides a fixed rate of continuous rapid-acting insulin for 72 hours. The company sells its products primarily through independent distributors and pharmacy channels, as well as directly in the United States, Canada, Europe, the Middle East, Australia, and internationally. Insulet Corporation was incorporated in 2000 and is headquartered in Acton, Massachusetts.",0.0002597216286865681
